filename,text,word_count,has_medication,medication_mention,has_side_effect,side_effect_mention,has_dosage,side_dosage,cleansed_text
file16.txt.txt,"calm,happy, laugh more, just like a new person i like
",10,No,[],No,[],No,[],"calm , happy , laugh , like new person like"
file532.txt.txt,"i am so sensitive to anti depression meds....abidal controls my emotions...i only take one 20mg pill a day...if i am anxious or sad i will take another....but less is best....i have been on it for years...and when i do not take it i can feel the effectscoming on...it has been a blessing for me.............
",54,Yes,['abidal'],No,[],Yes,['20mg'],sensitive anti depression med ... .abidal control emotion ... take one 20mg pill day ... anxious sad take another ... .but less best ... .i year ... take feel effectscoming ... blessing ... ... ... ... .
file1717.txt.txt,"DO NOT GO ON THIS MEDICATION!!! I was working alot, running two businesses. I felt I was a strong person, so I was concerned about the mental and physical effects I was experiencing. I went to a Dr., and was told I needed this pill, it would help. The Dr.told me he could not help me if I did not start this medication. Had I know what would happen when tring to get off, I would have never started. This will be my third time trying to stop taking this  non-addictive  medication. Believe me, this ISADDICTIVE, and the FDA should make the Wyth Company make people aware of this before they become an addict. The side effects of withdrawl are really, really bad.
",123,No,[],No,[],No,[],"DO NOT GO ON THIS MEDICATION ! ! ! I work clot , run two business . I felt I strong person , I concerned mental physical effect I experience . I go Dr. , told I need pill , would help . The Dr.told could help I start medication . Had I know would happen thing get , I would never start . This third time try stop take non-addictive medication . Believe , ISADDICTIVE , FDA make With Company make people aware become addict . The side effect withdrawn really , really bad ."
file1605.txt.txt,"I can not wean my self off. It makes me si sick if I miss a dose or if I don't take it at the same time. It's horrible and I would not recomend it to anyone.
",37,No,[],No,[],No,[],I wean self . It make si sick I miss dose I n't take time . It 's horrible I would recommend anyone .
file1505.txt.txt,"Due to side-effects from Aquiven I was diagnosed with Major Depressive Disorder. Ecstapin was the 3rd anti-depressant they put me on (I was sick of being a zombie every day on anti-depressants).  I take a variety of epilepsy medication which probably didn't help but I got violent on this med to the point where I punched my son in the face xmas day. 1mth later I stabbed someone - all totally out of character for me.  Whether it was just the ecstapin or the combination of Aquiven with it (Aquiven had the worstside-effects I have EVER experienced) I don't know.  But I certainly will never take either of them again.
",110,Yes,"['aquiven', 'ecstapin']",No,[],No,[],due side-effects quiver I diagnose Major depressive Disorder . Ecstapin 3rd anti-depressant put ( I sick zombie every day anti-depressants ) . I take variety epilepsy medication probably n't help I get violent med point I punch son face xmas day . 1th later I stabbed someone - totally character . Whether ecstatic combination quiver ( quiver coastside-effects I EVE experienced ) I n't know . But I certainly never take either .
file491.txt.txt,"I was on abidal for a little over a year, I think it helped me a little but not as much as I had hoped and I wish I had been better warned about the side effects and withdrawal. To everyone who's posted on here about being in withdrawal from it, hang inthere!! The symptoms with go away completely within a couple of months. One other major complaint I have about this stuff is it totally sucked away my motivation to exercise. Before I started taking it I was working out and running on a semi-regular basisand after a few weeks on abidal I had stopped entirely. I think the anti-anxiety part of it sort of sucks away your excess energy. Which I guess sort of makes sense because while I was on it I didn't get enraged over stupid things like I do sometimes before and after I was on it. All in all I think a decent diet, some exercise and trying to keep  yourself busy with things you enjoy doing is a better solution than abidal. If I ever feel like I need to go back on anti-depressants I think I'll try something that is a little more well tested and documented.
",205,Yes,['abidal'],No,[],No,[],"I abidal little year , I think help little much I hop I wish I well warn side effect withdrawal . To everyone 's post withdrawal , hang inhere ! ! The symptom go away completely within couple month . One major complaint I stuff totally suck away motivation exercise . Before I start take I work run semi-regular baseband week abidal I stop entirely . I think anti-anxiety part sort suck away excess energy . Which I guess sort make sense I I n't get enrage stupid thing like I sometimes I . All I think decent diet , exercise try keep busy thing enjoy well solution abidal . If I ever feel like I need go back anti-depressants I think I 'll try something little well test document ."
file275.txt.txt,"I've been on ability for approx. 3 months. I have been diagnosed with depression w/suicidal ideations and recently with mood disorder at the very least or bi-polar at the very most. While this drug is not perfect, I am not angry as much. When you first goon it or if your dosage increases, I became anxious and needed to move around more. After being on the dosage for 3 wks, I then return to normal. I take the drug at night as it does make you sleepy.In a perfect world, I wouldn't need drugs to function butprexifan is as close as I am gonna get. I advise it but you gotta stick with it through the temporary side effects.
",119,Yes,['prexifan'],No,[],No,[],"I 've ability approx . 3 month . I diagnose depression w/suicidal ideation recently mood disorder least bi-polar . While drug perfect , I angry much . When first goon dosage increase , I become anxious need move around . After dosage 3 , I return normal . I take drug night make sleepy.In perfect world , I would n't need drug function butprexifan close I gon na get . I advise get ta stick temporary side effect ."
file1322.txt.txt,"I suffered from Major Depression with suicidal tendencies and anxiety.  Abidal was the magic pill allowing my symptoms to settle down, stopping anxiety and thoughts of suicide.Results have been fantastic, insomnia is a problem,taking the drug in the early afternoon seems to control the sleeplessness.
",45,Yes,['abidal'],Yes,"['insomnia', 'sleeplessness']",No,[],"I suffer Major Depression suicidal tendency anxiety . abidal magic pill allow symptom settle , stop anxiety thought suicide.Results fantastic , insomnia problem , take drug early afternoon seem control sleeplessness ."
file1459.txt.txt,"I have taken this medication for about 2 years. I have had no negative reactions from the medication.
",18,No,[],No,[],No,[],I take medication 2 year . I negative reaction medication .
file1127.txt.txt,"I have been using this medication now for a few months.  I have found it very helpful.  Before I started this medication I was on elevex for 8 years and none of the doctors would listen to me when I would tell them it was not doing the job. I was having severe panic attacks and thoughts of suicide and found that I was actually Bipolar not just depressed by my surroundings as I had been told for so many years. My children couldnt stand me and honestly I couldnt stand myself. I felt like a whole different person was running my life while I sat quietly aside and watched.when I first started taking this medication I was still having some crying episodes I spoke with my doctor about this and he raised the amount that I take on a daily basis and all is well in life again. The only side effects that I have seen is that I have to take this medication no earlier than an hour prior to me needing to sleep because it makes me very drowsy, but for once I sleep all night!  Thank you DR O. AND ABIDAL FOR GIVING ME BACK MY LIFE.
",201,Yes,"['abidal', 'elevex']",No,[],No,[],"I use medication month . I found helpful . Before I start medication I eleven 8 year none doctor would listen I would tell job . I severe panic attack thought suicide found I actually bipolar depressed surroundings I told many year . My child couldnt stand honestly I couldnt stand . I felt like whole different person run life I sat quietly aside watched.when I first start take medication I still cry episode I spoke doctor raise amount I take daily basis well life . The side effect I see I take medication earlier hour prior need sleep make drowsy , I sleep night ! Thank DR O . AND ABIDAL FOR GIVING ME ACK MY LIFE ."
file1523.txt.txt,"On this medication for 2 months. Changed from Promican due to an non-critical side affect. Change over was practically seamless.
",20,Yes,['promican'],No,[],No,[],On medication 2 month . change Promin due non-critical side affect . Change practically seamless .
file397.txt.txt,"I took the pills for 3 weeks and I had a mental breakdown from the pills.  I wound up attempting suicide and going to the hospital.
",26,No,[],No,[],No,[],I take pill 3 week I mental breakdown pill . I wound attempt suicide go hospital .
file53.txt.txt,"I take this with elevex.Side effects were minor and went away after a week or so,
",16,Yes,['elevex'],No,[],No,[],"I take eleven.side effect minor go away week ,"
file1481.txt.txt,"I was on Ecstapin for 8 years for depression/mild anxiety through the end of high school and through college. I had been on various dosages of Elevex, Escalan, Promican with either poor side effects (inability to orgasm) or poor effectiveness. Doc put me on150mg of Ecstapin. It helped my depression, anxiety and libido but the side effects and withdrawl were horrible and TOTALLY debilitating!The Doc's didn't want me to go off of the pill. They said depression was  in my genes  and I would fight it my whole life. Well, as a biologist, let me tell you that THAT is NOT always the case. I have been anti-depressant free for 4 years and I have never felt more clear, fresh, raw and happy than I do now. Sure there are bummers, sometimes every day. But I just focus on the good parts and count my blessings with my shakey fingers every moment I remember to!
",155,Yes,"['ecstapin', 'elevex', 'escalan', 'promican']",No,[],Yes,['150mg'],"I Ecstapin 8 year depression/mild anxiety end high school college . I various dosage clever , escalan , Promin either poor side effect ( inability orgasm ) poor effectiveness . Don put on150mg Ecstapin . It help depression , anxiety libido side effect withdrawn horrible TOTALLY debilitate ! The Don 's n't want go pill . They say depression gene I would fight whole life . Well , biologist , let tell THAT NOT always case . I anti-depressant free 4 year I never felt clear , fresh , raw happy I . sure bummer , sometimes every day . But I focus good part count blessing shake finger every moment I remember !"
file514.txt.txt,"I have been on this medication for almost 5 years and have had no problem with it. Had to try several before this one.
",24,No,[],No,[],No,[],I medication almost 5 year problem . Had try several one .
file1644.txt.txt,"Ecstapin (in combination w/Exulactin)has  made my life wonderful. While it has stopped working several times,changing the dose and that of the Exulactin has kept me from going down the slippery slope. I take only 75 mgs.
",36,Yes,"['ecstapin', 'exulactin']",No,[],Yes,['75 mg'],"Ecstapin ( combination w/Exulactin ) make life wonderful . While stop work several time , change dose Exulactin kept go slippery slope . I take 75 m ."
file460.txt.txt,"Abidal 120 mg.daily works very well to relieve my 25-year depression. But it causes me terrible constipation. I have been having to take 10 Dulcolax tabs a day just to have BMs at all.
",34,Yes,['abidal'],Yes,['constipation'],Yes,['120 mg.'],abidal 120 mg.daily work well relieve 25-year depression . But cause terrible constipation . I take 10 Dulcolax tab day Bts .
file1496.txt.txt,"This medicine helped me at first but when I stopped taking it I went through horrible withdrawal. I felt out of control and I would have ringing in my ears that would'nt go away. I would ask lots of questions before I accepted this as a form of treatment!
",49,No,[],No,[],No,[],This medicine help first I stop take I go horrible withdrawal . I felt control I would ring ear would'nt go away . I would ask lot question I accepted form treatment !
file118.txt.txt,"Is it alright to take this if you have a seizure disorder?
",12,No,[],No,[],No,[],Is alright take seizure disorder ?
file1597.txt.txt,"have suffered from depression on and off for many years.  I was put on this the end of July.  I am on only 37.5 mg and finally am feeling the best I have felt in years. With a slow metabolism I generally use smaller doses than many.  My doctor said I may be on it for up to a year.  What works with some dosent always work for others.  I am still amazed.  and I hope it continues, I do feel warmer at night than usaual.  That is the only side effect now.
",93,No,[],No,[],Yes,['37.5 mg'],"suffer depression many year . I put end July . I 37.5 mg finally feel best I felt year . With slow metabolism I generally use small dos many . My doctor say I may year . What work docent always work others . I still amaze . I hope continue , I feel warmer night usual . That side effect ."
file203.txt.txt,"Follow-up from my post of 3/15. (56 year old female). I am now cutting my 5 mg. pills in half and doing fantastic on 2.5 mg a day. No restlessnes, insomnia, or nausea.Taking right before bed seems to work best for me. I am happy w/ no depressive moods forthe first time in 35 years and I have a social life and keep in touch w/ family/friends. Before I frequently isolated because of the moods. This medication has a dramatic effect on my life and I feel so blessed to have it. Good luck to all.
",96,No,[],Yes,"['insomnia', 'nausea']",Yes,"['5 mg.', '2.5 mg']","Follow-up post 3/15 . ( 56 year old female ) . I cut 5 mg. pill half fantastic 2.5 mg day . No restlessness , insomnia , nausea.Taking right bed seem work best . I happy w/ depressive mood forth first time 35 year I social life keep touch w/ family/friends . Before I frequently isolated mood . This medication dramatic effect life I feel bless . Good luck ."
file158.txt.txt,"I am currently taking 2 mg of Prexifan along with 100 mg of Escalan.  For the first few weeks I felt incredible.  Back to myself with energy, positive attitude, friendlier and overall happier.  BUT... I have gained 10 pounds in 2 months.  While I'm relatively thin, the cons are beginning to outweight the pros.  I am starting to lose the positive affects of this drug, I'm going back to low energy and irritability.  I don't know where to go from here because I've been on SO many other drugs-- more than 10.  I'd be grateful for any suggestions.
",98,Yes,"['escalan', 'prexifan']",Yes,"['irritability', 'weight gain']",Yes,"['2 mg', '100 mg']","I currently take 2 mg Prexifan along 100 mg escalan . For first week I felt incredible . Back energy , positive attitude , friendlier overall happier . BUT ... I gain 10 pound 2 month . While I 'm relatively thin , con begin outweight pro . I start lose positive affect drug , I 'm go back low energy irritability . I n't know go I 've SO many drug -- 10 . I 'd grateful suggestion ."
file310.txt.txt,"I started abidal about 6 mths ago.At first i was a little nauseous but that subsided after a few weeks.I did feel better at first but now i am feeling like it doesn't work as well.Please be aware that stopping this med on your own is very dangerous.I stopped for 3 days and became dizzy,vomiting,stomach cramps and had a severe headache.That evening i took my usual dose 60mg and within 1 hour i felt much better.I was prescribed this med fordepression and anxiety,it helps with the sadness but not the anxiety.It also gives me crazy colorful dreams which doesn't bother me very much.I have noticed i sweat alot more than i used to but with all of the side effects i still would recommend this medication.
",126,Yes,['abidal'],Yes,"['headache', 'vomiting']",Yes,['60mg'],"I start abidal 6 mt ago.At first little nauseous subside weeks.I feel well first feel like n't work well.Please aware stop med dangerous.I stop 3 day become dizzy , vomit , stomach cramp severe headache.That even take usual dose 60mg within 1 hour felt much better.I prescribed med nondepression anxiety , help sadness anxiety.It also give crazy colorful dream n't bother much.I notice sweat clot use side effect still would recommend medication ."
file1547.txt.txt,"I'm on Ecstapin 150mg.  I've been taking Ecstapin for 5 years. I'm struggling with depression again and I'm going up to 300mg.  I guess my body is metabolizing the drug. It has worked very, very well for most of the 5 years.
",42,Yes,['ecstapin'],No,[],Yes,"['150mg.', '300mg.']","I 'm Ecstapin 150mg . I 've take Ecstapin 5 year . I 'm struggle depression I 'm go 300mg . I guess body metabolize drug . It work , well 5 year ."
file1871.txt.txt,"I was just wondering how long it took everyone before they started to feel better on this medication?  I've been on it for 2 weeks and it hasn't helped yet.  The Dr. sais hang in there and give this med a chance
",42,No,[],No,[],No,[],I wonder long take everyone start feel well medication ? I 've 2 week n't help yet . The Dr. sais hang give med chance
file415.txt.txt,"This medicine has seem to turn my life around, it has helped A LOT!!!
",14,No,[],No,[],No,[],"This medicine seem turn life around , help A LO ! ! !"
file1105.txt.txt,"I used to take Cenerol but it made me numb when it came to my feelings.  So I stopped taking it.  I started Abidal and and also take Revinor AR and between the two, I feel like a new person - no more depression and no more anxiety.
",48,Yes,"['abidal', 'cenerol', 'revinor']",No,[],No,[],"I use take general make numb come feeling . So I stop take . I start abidal also take Reasnor AR two , I feel like new person - depression anxiety ."
file393.txt.txt,"just started
",2,No,[],No,[],No,[],start
file236.txt.txt,"headaches, low b/p like 94/58back pain-rated severe, cramps at nite in legs and feet.  joints ache
",16,No,[],Yes,"['back pain', 'headache', 'joint pain', 'leg cramps']",No,[],"headache , low b/p like 94/58back pain-rated severe , cramp nite leg foot . joint ache"
file1456.txt.txt,"After a year on this medicine I can tell you it works. I have had bad symptoms if I forget to take my daily pill, so I never forget it. Other then that, I think it works very well for me.
",41,No,[],No,[],No,[],"After year medicine I tell work . I bad symptom I forget take daily pill , I never forget . Other , I think work well ."
file49.txt.txt,"BE CAREFUL WITH THIS MED. Thought this was the answer! However, after the 2nd month I started getting very weird...fidgety, restless, paranoia (by the 3rd month I was afraid to even drive!) It almost made me loose my mind! (What was left of it.) Stopped taking after 5 months, it has taken almost a year for me to recover from the side effects.
",63,No,[],No,[],No,[],"BE CAREFUL WITH THIS MED . thought answer ! However , 2nd month I start get weird ... fidgety , restless , paranoia ( 3rd month I afraid even drive ! ) It almost make loose mind ! ( What left . ) stop take 5 month , take almost year recover side effect ."
file154.txt.txt,"within 3 weeks of use, i have noticed a big difference in my depression and nerves. this medicine saved my life. but it is so expensive even with insurance.
",29,No,[],No,[],No,[],"within 3 week use , notice big difference depression nerve . medicine save life . expensive even insurance ."
file131.txt.txt,"within 4 hrs of taking the 1st pill I started vomiting, had difficulty swollowing, dizziness, blurry vision, thought I was going to die.
",23,No,[],Yes,"['dizziness', 'vomiting']",No,[],"within 4 hr take 1st pill I start vomit , difficulty swallow , dizziness , blurry vision , thought I go die ."
file1895.txt.txt,"I was prescribed Ecstapin (not the XR) a few years back.  I tried half of a pill, and had the feeling that I was wound up so tight, I could snap like a rubber band! I couldn't even urinate, my body felt so tense! It was terrifying.  I went to bed, and slept for 15 hours, staying in bed until I was sure it had all worn off.  Its a shame, because nothing really has worked well for me, and this sounded promising.  I'm way to scared to take any other drugs in the same class. SNRI?
",97,Yes,['ecstapin'],No,[],No,[],"I prescribed Ecstapin ( X ) year back . I try half pill , feel I wound tight , I could snap like rubber band ! I could n't even urinate , body felt tense ! It terrify . I go bed , slept 15 hour , stay bed I sure worn . Its shame , nothing really work well , sound promising . I 'm way scar take drug class . SRI ?"
file531.txt.txt,"I take Abidal for two reasons depression and neuropathic pain in my legs.  Abidal has helped me so very much with my leg pain and with my depression.  I can walk now without pain in my legs.  That to me is great.
",42,Yes,['abidal'],No,[],No,[],I take abidal two reason depression neuropathic pain leg . abidal help much leg pain depression . I walk without pain leg . That great .
file1234.txt.txt,"I have been on several different drugs for my depression and panic attacks. Thi sone is so far the best all the way around
",24,No,[],No,[],No,[],I several different drug depression panic attack . The sone far best way around
file1094.txt.txt,"I was on this for 9 months, up to 90mg a day.  Had the usual side effects but no other medication helped my depression as Abidal.  I couldn't believe the difference.  Now my new insurance doesn't cover it so I have to wean off it.  Now I have the brain zaps, lack of energy, dizziness, etc. from withdrawal that others have described on here.  Its is horrible, can't function hardly at all.  Would like to  other peoples schedules of getting off this stuff.  I am currently on 30mg. and taking one pill every 3 days now.  Just wondering how long others had to take it and what their final schedule was when they finally stopped.  So glad I read the withdrawal posts on here, now I know it isn't just me.  Anyone that can post some withdrawal schedule information, Iwould really appreciate it.  My Dr. wanted me to go from 90mg. daily to 60mg daily for one week, then one 60mg every other day for one week then stop.  Glad I didn't do it that way, went back and got some 30mg samples to wean off at slower rate.
",189,Yes,['abidal'],Yes,['dizziness'],Yes,"['90mg', '30mg.', '90mg.', '60mg', '60mg', '30mg']","I 9 month , 90mg day . Had usual side effect medication help depression abidal . I could n't believe difference . Now new insurance n't cover I wean . Now I brain zap , lack energy , dizziness , etc . withdrawal others described . Its horrible , ca n't function hardly . Would like people schedule get stuff . I currently 30mg . take one pill every 3 day . Just wonder long others take final schedule finally stop . So glad I read withdrawal post , I know n't . anyone post withdrawal schedule information , would really appreciate . My Dr. want go 90mg . daily 60mg daily one week , one 60mg every day one week stop . Glad I n't way , go back get 30mg sample wean slow rate ."
file1536.txt.txt,"I am taking 150 mg for about 2 months now during which time I slowly stopped taking another a-dep which was a nightmare in it self. Still feeling depressed/anxiety ect. I want to stop taking but not looking forward to detoxing again. Going to see my Phychtomorrow maybe I will try Abidal w/ essequal. ecstapin is not a happy pill.
",60,Yes,"['abidal', 'ecstapin', 'essequal']",No,[],Yes,['150 mg'],I take 150 mg 2 month time I slowly stop take another a-dep nightmare self . Still feel depressed/anxiety ect . I want stop take look forward detox . Going see Phychtomorrow maybe I try abidal w/ esexual . ecstatic happy pill .
file323.txt.txt,"I've been on abidal for 3 years.  I haven't had any problems with it.  No suicidial thoughts.
",17,Yes,['abidal'],No,[],No,[],I 've abidal 3 year . I n't problem . No suicidal thought .
file483.txt.txt,"After taking for 5 days I experienced stomach pain,vomiting,weakness so severe I was considering going to the ER.It also caused severe constpation.
",22,No,[],Yes,"['stomach pain', 'vomiting', 'weakness']",No,[],"After take 5 day I experienced stomach pain , vomit , weakness severe I consider go ER.It also cause severe constipation ."
file1201.txt.txt,"After breaking a leg, crushing my ankle, and having knee surgery to repair torn ligament, I needed an antidepressant with something to take care of residual pain. Works great.
",29,No,[],No,[],No,[],"After break leg , crush ankle , knee surgery repair torn ligament , I need antidepressant something take care residual pain . work great ."
file258.txt.txt,"I have been taking prexifan for a few months and my suicidal thoughts have disappeared.  I am a little more anxious and can't sit still but it's better than the depression and suicidal ideations.
",34,Yes,['prexifan'],No,[],No,[],I take prexifan month suicidal thought disappear . I little anxious ca n't sit still 's well depression suicidal ideation .
file1893.txt.txt,"After trying numerous other anti-depressants, I found Ecstapin.  No other has been able to decrease my depression and anxiety like it.  My depression decreased by about 75% and my anxiety about 90%.  I am now a motivated and happy woman!
",40,Yes,['ecstapin'],No,[],No,[],"After try numerous anti-depressants , I found Ecstapin . No able decrease depression anxiety like . My depression decrease 75 % anxiety 90 % . I motivate happy woman !"
