filename,text,word_count,has_medication,medication_mention,has_side_effect,side_effect_mention,has_dosage,side_dosage,cleansed_text
file475.txt.txt,"Abidal has taken me out of a deep depression. Before Abidal I had no interest in things and no urge to do anything. Now I'm back to my old self. So far no bad side effects.
",36,Yes,['abidal'],No,[],No,[],abidal take deep depression . Before abidal I interest thing urge anything . Now I 'm back old self . So far bad side effect .
file1533.txt.txt,"This is a great medication but it does have side effects.  Make sure you don't miss a day, or you will know it. The trade off is worth it for me. I do miss my sex drive though.
",38,No,[],No,[],No,[],"This great medication side effect . Make sure n't miss day , know . The trade worth . I miss sex drive though ."
file1187.txt.txt,"Whatever you do, make sure that you do NOT forget to take your medication --- even three days off on accident will cause MAJOR psychological problems beyond what were already being treated.
",32,No,[],No,[],No,[],"Whatever , make sure NOT forget take medication -- - even three day accident cause MAR psychological problem beyond already treat ."
file1591.txt.txt,"I've been taking Ecstapin about a year but have become concerned about some possible health issues which I didn't assume were side effects until I started reading these postings. I started hearing music in my head when hospitalized in April   it continues to date. About 2-3 mos after I fell   fractured my pelvis, my hair started falling out   still is. I have dry mouth,hoarseness, difficulty at times swallowing. Been blaming everything on the recovery from the fall, but now I wonder. I'm going to call my dr tomorrow   try to get off this.
",93,Yes,['ecstapin'],Yes,['dry mouth'],No,[],"I 've take Ecstapin year become concerned possible health issue I n't assume side effect I start reading posting . I start hearing music head hospitalize April continue date . About 2-3 mo I fell fracture pelvis , hair start fall still . I dry mouth , hoarseness , difficulty time swallow . Been blame everything recovery fall , I wonder . I 'm go call dr tomorrow try get ."
file1851.txt.txt,"I have been on Ecstapin for 6 years for anxiety/depression. The Ecstapin got me out of a hell hole. But for the last year, I have been experiencing advancing blurriness, aggitation and finally jaundice. Because of my moods going up and down, I thought and also my psychiatrist thought that I was bipolar so he put me on MERIFLEX.I couldn't tolerate this med. because it caused severe joint pain. I had blood work checked last March and the results were all normal except for my cholesterol and triglycerides wereelevated. These are side effects of Ecstapin. I wish I had read all this information when all the symptoms started happening to my body. I should have gone on the computer and read all the side effects instead of being naive. I questioned my psychiatrist and he thought that I was rationalizing too much between an elevated blood pressure and an increase with my aggitation. (Jee, I am not bipolar after all). I guess I was right and he was definately wrong. Even though we have  mental issues , we should take all the changes in our behavior seriously after we are put on these medications. Our chemical imbalances lead us to take these chemicals. I have been off the med for almost 2 weeks after cutting myself down (I work in a doctor's office) and themain withdrawal was dizziness and I had to really concentrate on what I was saying. I feel great right now, no depression or anxiety. I hope and pray I remain this way and I hope that everyone pays attention to each and every day while on this med. Keep adiary.
",274,Yes,"['ecstapin', 'meriflex']",Yes,"['dizziness', 'jaundice', 'joint pain']",No,[],"I Ecstapin 6 year anxiety/depression . The Ecstapin get hell hole . But last year , I experience advance blurriness , agitation finally jaundice . Because mood go , I thought also psychiatrist thought I bipolar put MERIFLEX.I could n't tolerate med . cause severe joint pain . I blood work checked last March result normal except cholesterol triglyceride reelevated . These side effect Ecstapin . I wish I read information symptom start happen body . I go computer read side effect instead naive . I question psychiatrist thought I rationalize much elevate blood pressure increase agitation . ( see , I bipolar ) . I guess I right definitely wrong . Even though mental issue , take change behavior seriously put medication . Our chemical imbalance lead u take chemical . I med almost 2 week cut ( I work doctor 's office ) thebain withdrawal dizziness I really concentrate I say . I feel great right , depression anxiety . I hope pray I remain way I hope everyone pay attention every day med . Keep diary ."
file1766.txt.txt,"I have been on this med for about 5 years topping at 375mg a day. It worked well once I was regulated.After a year or so I tapered off I wanted to get off them eventually.I took 150mg for a long time.I tried getting off several times and trust me you never want to just stop which I did a few times because I ran out an just figured I would go off them,dont do that. Anyway I am still trying to get off them. I have been on about 17.5 mg for 8 months now. For about 5 months I have been only taking the 1/4 tablet every few days, just when I start getting the withdrawl symptoms. The symptoms are awful. I have tried and waited about 24-30 hours after symptoms start to see if they might go away but in that amount of time they never have and I end up taken the med. I had been told when I started them that I would just tapper off over a few weeks. Wow,years later. When I had told my Doctor about all the anxiety and other withdrawl symptoms he said I was just going to have to stay on them.....forever.that was not ok with me. Anyway just know I think I have read a few blogs from people at another site that had no problems getting off. Most were like me though so if you are reading up on theis drug before you take it you have been warned it is not fun at all getting off this.If you think how bad could it be, well if you think you are depressed now plus worse things and feelings. good luck
",283,No,[],No,[],Yes,"['375mg', '150mg', '17.5 mg']","I med 5 year top 375mg day . It work well I regulated.After year I taper I want get eventually.I take 150mg long time.I try get several time trust never want stop I time I ran figure I would go , dont . anyway I still try get . I 17.5 mg 8 month . For 5 month I take 1/4 tablet every day , I start get withdrawn symptom . The symptom awful . I try wait 24-30 hour symptom start see might go away amount time never I end take med . I told I start I would tapper week . , year later . When I told Doctor anxiety withdrawn symptom say I go stay ... ..forever.that ok . anyway know I think I read blog people another site problem get . Most like though reading drug take warn fun get this.If think bad could , well think depressed plus bad thing feeling . good luck"
file214.txt.txt,"I am on this and Abidal.  It has made a world of difference on my mood.  I feel a hundred time better.  I haven't had any side effects.
",28,Yes,['abidal'],No,[],No,[],I abidal . It make world difference mood . I feel hundred time well . I n't side effect .
file338.txt.txt,"I have found that I am angrier than before I was on this medicine,   still am depressed.
",17,No,[],No,[],No,[],"I found I angrier I medicine , still depressed ."
file1349.txt.txt,".I was using Ecstapin and was getting more and more depressed. Finally, I asked my dear sweet doctor i he could switch me to Abidal! Within 2 days I was feeling better! Within a week I was feeling terric, within a two weeks - I am soooooooooooooo happy! I have my life back! I enjoy life again! I still have a few areas to work on, but it's normal areas that normal people work on. Now I can cope with them.
",81,Yes,"['abidal', 'ecstapin']",No,[],No,[],".I use Ecstapin get depressed . finally , I ask dear sweet doctor could switch abidal ! Within 2 day I feel well ! Within week I feel tetric , within two week - I soooooooooooooo happy ! I life back ! I enjoy life ! I still area work , 's normal area normal people work . Now I cope ."
file1484.txt.txt,"I have had good results w/ this drug.  It also helped alleviate my PMS symptoms, which were severe.  I made the mistake, once, of not getting my prescription refilled on time and had MAJOR withdrawl symptoms--vomiting, migraine, not being able to keep anything in my stomach.  I will never do that again.
",52,No,[],Yes,['vomiting'],No,[],"I good result w/ drug . It also help alleviate PMS symptom , severe . I make mistake , , get prescription refill time MAR withdrawn symptom -- vomit , migraine , able keep anything stomach . I never ."
file1810.txt.txt,"I've been on Ecstapin for about 4 years now. I don't experience deep depression anymore and my panic attacks are gone. No weight gain, no bad side effects.
",28,Yes,['ecstapin'],Yes,['weight gain'],No,[],"I 've Ecstapin 4 year . I n't experience deep depression anymore panic attack go . No weight gain , bad side effect ."
file1549.txt.txt,"I have been on ecstapin for 7 months and the dosage is 225mg once a day. I ran into a complication with getting my script renewed and had to go without it for a few days. I went through the worst withdrawals ever. I have gone through withdrawals from a severe addiction to a very strong illegal drug and THAT wasn't even this bad! It caused vertigo as well as horrible sweating, nausea, abdominal pain, eye pain from the light, and the worst mood swings ever! My husband had to take me to the ER because he foundme on the kitchen floor and all the chairs were knocked over, apparently I had fallen. I couldn't remember anything at all until an hour after I had taken a dose of the ecstapin which the doctor had given me.Also.  Since I have been on the ecstapin, I have become an anti-social zombie. I barely get out of bed and my already lack of motivation turned into a lack of life period. The only thing I like about this medication is the fact that it stabilizes my mood, well... more like it keeps me mono-toned 100% of the time. I no longer have extreme lows or highs.
",204,Yes,['ecstapin'],Yes,"['abdominal pain', 'nausea', 'sweating', 'vertigo']",Yes,['225mg'],"I ecstatic 7 month dosage 225mg day . I ran complication get script renew go without day . I go bad withdrawal ever . I go withdrawal severe addiction strong illegal drug THAT n't even bad ! It cause vertigo well horrible sweat , nausea , abdominal pain , eye pain light , bad mood swing ever ! My husband take ER found kitchen floor chair knock , apparently I fall . I could n't remember anything hour I take dose ecstatic doctor give me.Also . Since I ecstatic , I become anti-social zombie . I barely get bed already lack motivation turn lack life period . The thing I like medication fact stabilizes mood , well ... like keep mono-toned 100 % time . I longer extreme low high ."
file1063.txt.txt,"on 3years effects wore off
",5,No,[],No,[],No,[],3years effect wore
file1446.txt.txt,"I have been taking Ecstapin entering into six years.  My prior experiences with anti-depressants has not been positive (dramatic mood changes), but with Ecstapin I am  even .  I am able to cope and manage my depression and anxiety with the medication.  I believe I will always have sever depression and anxiety, but Ecstapin helps me function a quasi normal life.The effects can be dramatic, I have two friends who suddenly and scarily became suicidal whilst under Ecstapin.  They obviously sought other treatment, but I have never once had such thoughts-thankfully.  I occasionally experience  brain shivers  which, while unnerving, does not last long.  I do fear what effects there are to my brain and vision in the long term (many new medications long term studies have not been conducted).
",129,Yes,['ecstapin'],No,[],No,[],"I take Ecstapin enter six year . My prior experience anti-depressants positive ( dramatic mood change ) , Ecstapin I even . I able cope manage depression anxiety medication . I believe I always sever depression anxiety , Ecstapin help function quasi normal life.The effect dramatic , I two friend suddenly scarily become suicidal whilst Ecstapin . They obviously sought treatment , I never thoughts-thankfully . I occasionally experience brain shiver , unnerve , last long . I fear effect brain vision long term ( many new medication long term study conduct ) ."
file1916.txt.txt,"I started w/75mg for depression and anxiety, it helped almost immediately. 3 years later, I felt that it was not working any longer.  I wanted to get off but then my fiance died of cancer so the doc put me on 150 mg, where I am today, almost 4 years later.  I HATE the prison this med has sentenced me to.  It is hellish coming off of this stuff - I tried 7 months ago and I am gathering all my strength to try again.  Even the doctors don't know how to get me off of this, just lower the dosage and MAYBE, I can quit, EVENTUALLY.  It is dangerous driving while in withdrawal, I am afraid to take walks alone - I feel like a kid running with scissors - everything is dangerous because I can't focus, I am constantly going in and out of dizziness, nausea and crying spells.  Ecstapin and ecstapin by any other name should be BANNED.
",161,Yes,['ecstapin'],Yes,"['dizziness', 'nausea']",Yes,"['75mg', '150 mg']","I start w/75mg depression anxiety , help almost immediately . 3 year later , I felt work longer . I want get fiance die cancer doc put 150 mg , I today , almost 4 year later . I HAT prison med sentence . It hellish come stuff - I try 7 month ago I gathering strength try . Even doctor n't know get , low dosage MAY , I quit , EVENTUALLY . It dangerous drive withdrawal , I afraid take walk alone - I feel like kid run scissors - everything dangerous I ca n't focus , I constantly go dizziness , nausea cry spell . Ecstapin ecstatic name BAND ."
file1917.txt.txt,"This medication was first prescribed for me in 1999, after an old spinal injury flared up. From the very beginning The medication did exactly what it's supposed to do. I started out taking the Ecstapin at a very low dose and was  built up  to the 150 mg a day,that I've taken for so long. About 4 years ago the medication was increased to 150 mg Am   150 mg PM. About 1 year ago I noticed that the medication didn't seem to be working as effectively as it always had. So, about 8 months ago, my Dr added Exulactin SR 150 mg to my medications. I don't take the exulactin every day, just on those days that I feel is gonna be a really bad day. On those days I take 150 mg Ecstapin   150 mg Exulactin SR AM and if I feel that I need it I take itthe same way at night, before I go to bed. Over all The medication has worked very well for me.
",169,Yes,"['ecstapin', 'exulactin']",No,[],Yes,"['150 mg', '150 mg', '150 mg', '150 mg', '150 mg', '150 mg']","This medication first prescribed 1999 , old spinal injury flare . From begin The medication exactly 's suppose . I start take Ecstapin low dose built 150 mg day , I 've take long . About 4 year ago medication increase 150 mg Am 150 mg PM . About 1 year ago I notice medication n't seem work effectively always . So , 8 month ago , Dr add Exulactin SR 150 mg medication . I n't take exulactin every day , day I feel gon na really bad day . On day I take 150 mg Ecstapin 150 mg Exulactin SR AM I feel I need I take tithe way night , I go bed . Over The medication work well ."
file1855.txt.txt,"I have been on this for 2 years and I find it works great. The only drawback I find is that if something terrible happens I don't feel anything.
",29,No,[],No,[],No,[],I 2 year I find work great . The drawback I find something terrible happens I n't feel anything .
file1351.txt.txt,"Works better than 2 previous meds for me! Kicking both mental and physical symptoms.  Side effects are live-able by comparison!
",20,No,[],No,[],No,[],work well 2 previous med ! pick mental physical symptom . side effect live-able comparison !
file1433.txt.txt,"I used this and it was my miracle drug! It helped me in so many ways, but when it started to lose effectiveness then I was taken off of it. My Doc took me off cold turkey and I would not suggest that to anyone. Withdrawls were/are awful!! But I'm still thankful that I was able to be on it and have some 'normal' time. But here I go again, trying to find something that works!
",76,No,[],No,[],No,[],"I use miracle drug ! It help many way , start lose effectiveness I take . My Don take cold turkey I would suggest anyone . withdraws were/are awful ! ! But I 'm still thankful I able 'normal ' time . But I go , try find something work !"
file259.txt.txt,"I was given this medication as a piggy back to my MERIFLEX (which works great as a mood stabilizer also).  I love this medicaton!  It kicked in immediatly...meaning days to a week.  I was doing horrably with my bi-polar depression and this just kicked in and kicked rear!  I take it at night so haven't noticed any side effects.
",59,Yes,['meriflex'],No,[],No,[],I give medication piggy back MERIFLEX ( work great mood stabilizer also ) . I love medication ! It kick immediatly ... meaning day week . I horribly bi-polar depression kick kick rear ! I take night n't notice side effect .
file115.txt.txt,"Amazing change from a tiny little pill. Have had chronic dysthymia punctuated by major depressive episodes for 30+ years, even though I've tried many different anti-depressants. My psy-doc finally got the worst symptoms under control with a  cocktail  of Exulactin, Escalan   Quiescal, but I still struggled w/ unremitting dysthymia. Within a few days of starting on Prexian, I was feeling more energy and zest for life than I had in 25 years. My chronic philosophical funk ( What the heck is the point in living?? ) is gone. I can actually feel joy. I am so grateful for this med!
",100,Yes,"['escalan', 'exulactin', 'quiescal']",No,[],No,[],"amaze change tiny little pill . Have chronic dysthymia punctuate major depressive episode 30+ year , even though I 've try many different anti-depressants . My pay-doc finally get bad symptom control cocktail Exulactin , escalan Quiescal , I still struggle w/ unremitting dysthymia . Within day start Persian , I feel energy zest life I 25 year . My chronic philosophical funk ( What heck point living ? ? ) go . I actually feel joy . I grateful med !"
file239.txt.txt,"I have bipolarII and take this in combination with MERIFLEX.  The complaint I have is serious loss of memory.  I don't know whether this is due to this drug, MERIFLEX or depression itself.  My loss of memory is affecting my performance at work-it is both short- and long-term.  I am 50 years old, not old enough for this to be due solely to my age.
",65,Yes,['meriflex'],No,[],No,[],"I bipolar take combination MERIFLEX . The complaint I serious loss memory . I n't know whether due drug , MERIFLEX depression . My loss memory affect performance work-it short- long-term . I 50 year old , old enough due solely age ."
file1940.txt.txt,"I had great success for 2 yrs on this drug....but I gained 40 pounds, my blood pressure went up signifigantly, and I was constantly craving alcohol and pain. It has a sado-masocist type of effect...Getting tattoos and bodypeircings and feeling the need tobe hurt during sex. Even being treated like slave felt good..
",53,No,[],No,[],No,[],"I great success 2 yr drug ... .but I gain 40 pound , blood pressure go significantly , I constantly crave alcohol pain . It sado-masochist type effect ... get tattoo bodypeircings feel need tobe hurt sex . Even treat like slave felt good.."
file1787.txt.txt,"DO NOT TAKE THIS!!!!! Took this for a year, no real relief, tried to stop taking twice and the withdrawals were so bad I had to return to taking it. Most docs are unaware of the severe withdrawals. DO NOT try to stop cold turkey! Even forgetting a dose will start the brain  zaps/shivers  because of the short half-life of this med, and they are horrible! To get off of these with mild withdrawls, I had to break open the capsuls and SLOWLY start to decrease the amount inside. I took away about 1/4 and took 3/4 of the beads for a week or two, then brought it down to a half, then down to 1/2 of a 1/2, then to just however many would stick to a couple finger tips full, took about 6 weeks to wean myself off. It was awful. You couldn't pay me enough to take this drug EVER again!
",154,No,[],No,[],No,[],"DO NOT TAE THIS ! ! ! ! ! take year , real relief , try stop take twice withdrawal bad I return take . Most doc unaware severe withdrawal . DO NOT try stop cold turkey ! Even forget dose start brain zaps/shivers short half-life med , horrible ! To get mild withdraws , I break open capsule SLOWLY start decrease amount inside . I take away 1/4 take 3/4 bead week two , brought half , 1/2 1/2 , however many would stick couple finger tip full , take 6 week wean . It awful . You could n't pay enough take drug EVE !"
file277.txt.txt,"i have just started ambilify after trying meriflex for a month, meriflex was terrible i cried at the drop of a hat. ambilify with 20 mg of cenerol, 1mg colonapem,and 200mg seraquel seem to be working great so far. i havent had any energy in 3 yrs. and have gained 120 pounds in the past trying all these other drugs you usually have to go thru to find the right mix. hopefully i have found my mix of meds
",79,Yes,"['cenerol', 'meriflex']",No,[],Yes,"['20 mg', '1mg', '200mg']","start ability try semiflex month , semiflex terrible cry drop hat . ability 20 mg general , 1mg colonate , 200mg sequel seem work great far . havent energy 3 yr . gain 120 pound past try drug usually go thru find right mix . hopefully found mix med"
file346.txt.txt,"Has anyone experienced bad headaches with this medicine,i have been talking it for 3 days and have had a constant headache..Thinking about stopping to see if my headache goes away..
",30,No,[],Yes,['headache'],No,[],"Has anyone experienced bad headache medicine , talk 3 day constant headache..thinking stop see headache go away.."
file1392.txt.txt,"When this drug started to work, I really felt so great, but now I hate it. I weaned myself off it last year but the doctor put me back on it. I get severe pain now, the headache's are blinding, I have lost well over 3 stone, and now im seriously thinking that my thyroid problem is the rare side effects off this pill. Ive been on these well over 5 years now and im being told I might have cancer. DO NOT TOUCH THESE TABLETS. THERE NOT WORTH ALL THE SIDE EFFECTS ive got young children too and some days its so hard I cant cope, I can barely go out the house because of these pills.  GET THEM OFF THE MARKET
",123,No,[],Yes,"['back pain', 'headache']",No,[],"When drug start work , I really felt great , I hate . I wean last year doctor put back . I get severe pain , headache 's blinding , I lose well 3 stone , im seriously think thyroid problem rare side effect pill . Ive well 5 year im told I might cancer . DO NOT TUC THE TABLETS . THREE NOT ORT AL THE SIDE EFFECTS ive get young child day hard I cant cope , I barely go house pill . ET THE OF THE MARKET"
file210.txt.txt,"The first tablet I took made me shakey weak and light headed. My heart rate increased, I did not take another one. I have been on Exulactinxl and was hoping this med would help with my depression, but it didn't.
",40,Yes,['exulactin'],No,[],No,[],"The first tablet I take make shake weak light head . My heart rate increase , I take another one . I Exulactinxl hop med would help depression , n't ."
file1926.txt.txt,"works well with abidal for my depression and axenity
",9,Yes,['abidal'],No,[],No,[],work well abidal depression amenity
file1920.txt.txt,"This medication has helped my fight depression and anxity.
",9,No,[],No,[],No,[],This medication help fight depression anxiety .
file304.txt.txt,"my husband has been  depressed for over five years but refused to get help, finally got him to get to go to an endrocologist for his diabetes i was telling her about his mood swings she gave him abidal for his nuropathy and his mood swings he is a totally different person now, he is like he use to be when we were dating a mellow person who is nice to be around
",73,Yes,['abidal'],No,[],No,[],"husband depressed five year refuse get help , finally get get go endrocologist diabetes tell mood swing give abidal neuropathy mood swing totally different person , like use date mellow person nice around"
file221.txt.txt,"I am 15 yrs. old and i had to live through this and currently am living through my side effects from prexifan!!!its terriable!!bad out bursts of eye seizures!!!! no benefit wat so ever!!!!!
",33,Yes,['prexifan'],Yes,['seizures'],No,[],I 15 yr . old live currently living side effect prexifan ! ! ! terrible ! ! bad burst eye seizure ! ! ! ! benefit wat ever ! ! ! ! !
file1277.txt.txt,"I was diagnosed with MDD 10 years ago. During those years, I was prescribed several different kinds of medications for depression.  Each medication eventually caused adverse mental/mood reactions.  The last,(bupropion hydrochloride), being the most severe.  My doctor immediately stopped the bupropion and prescribed Abidal.  Within 3 weeks I was feeling great!  That was 1 year ago.  I'm feeling better than I have in years, and no side effects.  Abidal saved my life!
",72,Yes,['abidal'],No,[],No,[],"I diagnose DD 10 year ago . During year , I prescribed several different kind medication depression . medication eventually cause adverse mental/mood reaction . The last , ( bupropion hydrochloride ) , severe . My doctor immediately stop bupropion prescribed abidal . Within 3 week I feel great ! That 1 year ago . I 'm feel well I year , side effect . abidal save life !"
