filename,text,word_count,has_medication,medication_mention,has_side_effect,side_effect_mention,has_dosage,side_dosage,cleansed_text
file1398.txt.txt,"I have been suffering from severe depression for about 6 years. i have had docs try almost everything on me with no help! the ecstapin xr cause me severe stomach pain, inability to ejaculate, and made my depression ALOT worse. i had severe thoughts of suicide, could not get out to do anything, and i am an outdoors person. missed the spring crappie fishing, 4 wheeler riding in the mud, just couldnt bring myself to do anything? needless to say i stopped taking it. going back to doc on friday, probably have metry something else, but i just dont know what else there is? i have tried almost everything i have ever heard of and even ones i havent?
",119,Yes,['ecstapin'],Yes,"['back pain', 'stomach pain']",No,[],"I suffer severe depression 6 year . doc try almost everything help ! ecstatic xr cause severe stomach pain , inability ejaculate , make depression AT bad . severe thought suicide , could get anything , outdoors person . miss spring crappie fishing , 4 wheeler rid mud , couldnt bring anything ? needle say stop take . go back doc friday , probably merry something else , dont know else ? try almost everything ever heard even one havent ?"
file1315.txt.txt,"I have been on multiple medications for depression/anxiety disorders. Abidal has helped me feel close to normal.
",17,Yes,['abidal'],No,[],No,[],I multiple medication depression/anxiety disorder . abidal help feel close normal .
file1182.txt.txt,"After being promicanized for many years.(no sex drive, less emotive, less romantic etc).  I have been taking 90 mg per day for last 17 months.  Sex drive returned.  No major side effects. Combine this with Amelorex. Perinol made me feel more anxiety.
",42,Yes,"['amelorex', 'perinol', 'promican']",No,[],Yes,['90 mg'],"After promicanized many year . ( sex drive , less emotive , less romantic etc ) . I take 90 mg per day last 17 month . See drive return . No major side effect . combine Amelorex . Period make feel anxiety ."
file301.txt.txt,"the first week was hard. Lots of mania but it went away. I do not sleep as well now. Some dry monuth but now a month later i a getting bad headaches. I think do to my sinus's drying out and being stuffy all the time triggering migranes. I can not stop using nose spray which has made it worse. My neck pain got better as well as other pains in my body and that anquish anxity feeling did go abecaue of the migrane i am going to go off. it. It is a shame because it worked. The only thing to work in 8 years. It is worth it to try this medicine even thouth it has risk. It grately inproved my life untill the headaches came. Would recommed it.
",131,No,[],Yes,['headache'],No,[],first week hard . lot mania go away . I sleep well . Some dry mouth month later get bad headache . I think sinus 's dry stuffy time trigger migraine . I stop use nose spray make bad . My neck pain get well well pain body vanquish anxiety feel go migrate go go . . It shame work . The thing work 8 year . It worth try medicine even though risk . It gravely improve life untill headache come . Would recommend .
file1774.txt.txt,"I have been on anti-depressant drugs for several yrs   several different ones. This drug has helped me most   without any side affects.
",22,No,[],No,[],No,[],I anti-depressant drug several yr several different one . This drug help without side affect .
file1985.txt.txt,"I originally started taking  Ecstapin  almost ten years ago.  I am now on  Ecstapin  and believe me, it has helped so much in my life.  My husband can tolerate me more, my depression only comes a few times a year, my panic attacks areless and I have a good feeling most times.  Have noticed no side effects; if I miss a dosage I do not know who that person is, but I do not like her and I feel she is dangerous.  Has to be taken daily everyday and it really has helped me.  Ask my children.
",97,Yes,['ecstapin'],No,[],No,[],"I originally start take Ecstapin almost ten year ago . I Ecstapin believe , help much life . My husband tolerate , depression come time year , panic attack careless I good feel time . Have notice side effect ; I miss dosage I know person , I like I feel dangerous . Has take daily everyday really help . Ask child ."
file1133.txt.txt,"Although the abidal did treat my depression to the point that I could function once again, I do have a couple of major complaints. There was not nearly enough information prisolexd to me regardingTalk about a reason to be depressed!!! It's been 17 days and the brain zaps are almost gone and I am  starting  to feel like myself again-except for the weight gain. If I was eating carbs, sweets, etc. that would be one thing. But I follow a high protein, high vegetable diet.  Really consider the consequences.
",89,Yes,"['abidal', 'isolex']",Yes,['weight gain'],No,[],"Although abidal treat depression point I could function , I couple major complaint . There nearly enough information prisoned regardingTalk reason depressed ! ! ! It 's 17 day brain zap almost go I start feel like again-except weight gain . If I eat carbs , sweet , etc . would one thing . But I follow high protein , high vegetable diet . Really consider consequence ."
file1465.txt.txt,"horrible side effects. hard to get off
",7,No,[],No,[],No,[],horrible side effect . hard get
file1966.txt.txt,"I suffered from depression and some anxiety.  This drug relieved the depression and lessoned the anxiety.  I could tell if I forgot to take it, because I would start crying at the drop of a hat.  I had no problems when I quit the medication.  After awhile, my doctor worried that my weight gain might be an unusual side effect of the medication so I quit using it.
",68,No,[],Yes,['weight gain'],No,[],"I suffer depression anxiety . This drug relieve depression lessoned anxiety . I could tell I forgot take , I would start cry drop hat . I problem I quit medication . After awhile , doctor worried weight gain might unusual side effect medication I quit use ."
file305.txt.txt,"This medicine saved my life. I was diagnosed with major depressive disorder and panic attacks. I have taken this medicine since May of this year. It has made me lose 13 pounds already. So I have no complaints. It rocks !!!!
",41,No,[],No,[],No,[],This medicine save life . I diagnose major depressive disorder panic attack . I take medicine since May year . It make lose 13 pound already . So I complaint . It rock ! ! ! !
file1038.txt.txt,"I started this treatment and within days I was feeling much better. My depression has nearly completely went away. I feel like the person I was 3 years ago (before I started college). It also alleviated the chronic headaches that I have been having for over 9 years.
",48,No,[],Yes,['headache'],No,[],I start treatment within day I feel much well . My depression nearly completely go away . I feel like person I 3 year ago ( I start college ) . It also alleviate chronic headache I 9 year .
file279.txt.txt,"I took it for a month. I was throwing up all the time. Had to take additional meds to sleep. Developed numbness, tingling, and extremely painful muscle spasms. Felt as if my boby was there but my mind wasn't. Couldn't comprehend anything. I could hear people talking but not absorbing anything they said. I cried all the time and I'm not the crying type.Extremly detached from reality. It was an extremly horrible experience.
",73,No,[],Yes,"['muscle pain', 'spasm']",No,[],"I take month . I throw time . Had take additional med sleep . developed numbness , tingle , extremely painful muscle spasm . Felt body mind n't . Could n't comprehend anything . I could hear people talk absorb anything say . I cry time I 'm cry type.extremely detach reality . It extremely horrible experience ."
file1354.txt.txt,"This drug literally saved my life.Marcie
",6,No,[],No,[],No,[],This drug literally save life.Marcie
file238.txt.txt,"did nothing to help 2mg may be needed higher dosage
",10,No,[],No,[],Yes,['2mg'],nothing help 2mg may need high dosage
file1582.txt.txt,"Med has worked for me for depression.  It's not some great  happy  pill.  Biggest complaint is NO sex drive at all! Start to get off the med   sex drive comes back. Cannot just stop taking this! I felt the worst in my life when tried to quittaking it; zapping feeling, crying, very angry, nausea, headaches.....list goes on   on.
",58,No,[],Yes,"['headache', 'nausea']",No,[],"Med work depression . It 's great happy pill . big complaint NO sex drive ! Start get med sex drive come back . Can stop take ! I felt bad life try quit ; zap feel , cry , angry , nausea , headache ... ..list go ."
file159.txt.txt,"Users should be aware of Prexifan's potential to cause AKATHISIA.  The definition is available on wikipedia.
",16,Yes,['prexifan'],No,[],No,[],user aware Prexifan 's potential cause AKATHISIA . The definition available wikipedia .
file1414.txt.txt,"Finally I feel better after years of different drugs this is a life saver. Taking 225 every am and my mood is greatly improved. No side effects that I have noticed. Worth a try
",34,No,[],No,[],No,[],finally I feel well year different drug life saver . Taking 225 every mood greatly improve . No side effect I notice . Worth try
file473.txt.txt,"I have been taking this drug for several years.  I started out at just 30mg but now am all the way at 120mg.  If I am late taking this drug by 2 hours the horrible side effects begin.  If I miss it entirely I know it will be 24-48 hours before I feel okayagain.  Some have asked what Brain Zaps are..... I describe them as kind of like an electric shock/dizziness and blankness all at once.  I have insomnia now as well and have gained 25 pounds.  I am very fearful of coming off of them so that my husband andI can have another child.  It has completely taken away my anxiety and the severe bouts with depression and suicidal ideations.  I still, however have never regained any intrest in doing anything.  I haven't tried therapy and have put all my hopes into medication, which is lazy, I know.  I don't believe I would recommend this medication to anyone unless you'd tried several others first.
",165,No,[],Yes,"['dizziness', 'insomnia']",Yes,"['30mg', '120mg.']","I take drug several year . I start 30mg way 120mg . If I late take drug 2 hour horrible side effect begin . If I miss entirely I know 24-48 hour I feel okanagan . Some ask Brain cap ... .. I describe kind like electric shock/dizziness blankness . I insomnia well gain 25 pound . I fearful come husband another child . It completely take away anxiety severe bout depression suicidal ideation . I still , however never regain interest anything . I n't try therapy put hope medication , lazy , I know . I n't believe I would recommend medication anyone unless 'd try several others first ."
file1818.txt.txt,"felt like i had energy throughout the day. i was happy and had motivation to do things. the only downside that i foung was i felt wired alot of the time. but felt happy and energitic which i liked.
",39,No,[],No,[],No,[],felt like energy throughout day . happy motivation thing . downside young felt wire clot time . felt happy energetic like .
file516.txt.txt,"Do NOT take this drug!!  I took it for about 1-2 months.  I thought I was getting my life back (it wasn't so much of a jump b/c I am on another anti as well), WELL one night I forgot to take my abidal and OMG I had the WORST (and I do mean the worst) side effects ever!!  I felt as though I was going to hurt somebody or hurt myself.  I couldn't shake the feeling and couldn't figure out what it was from.  Well I finall remember to take it.  I then forgot once again not to take it (like a dumng donkey) and the same thing happened!!  So it was definately the drug, and when I told my doctoe his response was, well don't forget to take it.  =0  UHH duhh crap happens!
",136,Yes,['abidal'],No,[],No,[],"Do NOT take drug ! ! I take 1-2 month . I thought I get life back ( n't much jump b/c I another anti well ) , WELL one night I forgot take abidal OG I OST ( I mean bad ) side effect ever ! ! I felt though I go hurt somebody hurt . I could n't shake feel could n't figure . Well I finally remember take . I forgot take ( like dung donkey ) thing happen ! ! So definitely drug , I told doctor response , well n't forget take . =0 UH dush crap happens !"
file525.txt.txt,"this medication has helped me function like a normal human being. dry mouth and excessive sweating are worth it!
",19,No,[],Yes,"['dry mouth', 'sweating']",No,[],medication help function like normal human . dry mouth excessive sweat worth !
file1014.txt.txt,"I first took Cenerol for a few months, but it didn't help me much.  After I had my dosage increased from 10-15mg I felt awful.  I immediately switched to EcstapinXR.  At my highest dose of EcstapinXR I was at 150mg.  I was disappointed with the sexual side effects that I was experiencing with EcstapinXR, so my doctor prescribed a small dose of Exulactin to see if it would alleviate my symptoms.I'm glad I've switched to this medication!
",77,Yes,"['cenerol', 'ecstapin', 'exulactin']",No,[],Yes,"['15mg', '150mg.']","I first take general month , n't help much . After I dosage increase 10-15mg I felt awful . I immediately switch EcstapinXR . At high dose EcstapinXR I 150mg . I disappointed sexual side effect I experience EcstapinXR , doctor prescribed small dose Exulactin see would alleviate symptoms.I 'm glad I 've switch medication !"
file1798.txt.txt,"I have been on it for 3 months after many other medications and find it very effective. I he=ave been through many traumatic events in this time and am c=oping ok. Although I am an other drugs like valium and neulactil for sever panic attacks and anxiety.I have also been treated for post traumatic stress dis order and post natal depression, and have had electric shock treatment.
",67,No,[],No,[],No,[],"I 3 month many medication find effective . I he=ave many traumatic event time c=oping ok . Although I drug like valium neulactil sever panic attack anxiety.I also treat post traumatic stress dis order post natal depression , electric shock treatment ."
file1214.txt.txt,"i only taken for one day mood changes fast feel happier but way too many side effect nervousness  shakiness cant sleep at night throbbing headaches in neck and front of head anxiety seem to increase heart beat faster than normal being depressed is a ride it self .but takeing abidal is even more of a ride. too many synptoms for me  .only thing i can say is my  mood change fast and less pain in my back what is good but i dont like the side of effect   for me. very sensitive to drug
",94,Yes,['abidal'],Yes,"['back pain', 'headache']",No,[],take one day mood change fast feel happier way many side effect nervousness shakiness cant sleep night throb headache neck front head anxiety seem increase heart beat faster normal depressed ride self .but take abidal even ride . many symptom .only thing say mood change fast less pain back good dont like side effect . sensitive drug
file1584.txt.txt,"I moved with my husband to another state and had sad times because I left my family and friends. My doctor put me on ecstapin.
",25,Yes,['ecstapin'],No,[],No,[],I move husband another state sad time I left family friend . My doctor put ecstatic .
file1240.txt.txt,"I have been on Abidal for about 8 months now after being on 150mg of Ecstapin (450mg Ecstapin) 5 years ago but I tapered down myself. But NEVER totally get off of it if you have been at a high dosage for a year or more, I thought the world was coming to an end, crying etc.  Then I took a 75mg from my Psy and in a couple hours I was ok.  The Abidal I started 8 months ago was a 60mg pill by my family Dr. replacing the 150mg Ecstapin (Burn out or tolerance) and the change over was no problem and it did benefit I think, it's hard to tell.  So...I wnet to a Psychiatrist and he doubled the Abidal to 120 mg.  That seemed to do the trick!  He mentioned the 60mg max was not helping his patients so he conferred with other Psych's and they said their patients did well with taking 2 of the 60mg Abidal's.  In addition, I take Pronizen 1mg after work and 2 mg at night for teeth grinding.  If I son't have it at night I WON'T sleep.  So be careful.  It's like Revinor but last longer and the effect comes on much slower than Revinor.  Good Luck with your depression.  Remember, it's a brain chemical imbalance, NOT YOU!  I got it from my father's side of the family.  He's depressed all the time and won't take anything just like his father and his father's father committed suicide.  So...it's not a weakness, it's a disease.  Remember that!God Bless you all!
",260,Yes,"['abidal', 'ecstapin', 'pronizen', 'revinor']",Yes,['weakness'],Yes,"['150mg', '450mg', '75mg', '60mg', '150mg', '120 mg.', '60mg', '60mg', '1mg', '2 mg']","I abidal 8 month 150mg Ecstapin ( 450mg Ecstapin ) 5 year ago I taper . But EVE totally get high dosage year , I thought world come end , cry etc . Then I take 75mg Pay couple hour I ok . The abidal I start 8 month ago 60mg pill family Dr. replace 150mg Ecstapin ( Burn tolerance ) change problem benefit I think , 's hard tell . So ... I go psychiatrist double abidal 120 mg. That seem trick ! He mention 60mg max help patient confer psych 's say patient well take 2 60mg abidal 's . In addition , I take ironizes 1mg work 2 mg night teeth grind . If I n't night I WO N'T sleep . So careful . It 's like Reasnor last longer effect come much slow Reasnor . Good Luck depression . Remember , 's brain chemical imbalance , NOT YOU ! I get father 's side family . He 's depressed time wo n't take anything like father father 's father commit suicide . So ... 's weakness , 's disease . Remember ! God Bless !"
file1097.txt.txt,"I have had depresion and anxeity issues since my husband of 25 yrs was diagnosed with 4th stage throat cancer in october.He has gone thru radical chemo   radiation,plus surgery,and is now healing and cancer free they say,however during all that i was the caretaker and when it was all over ,realized I was going thru some very serious depression,cause i was flat out scared to death!I have been on abidal for about 2 weeks,and noticed a difference the first day!!I feel great,finally some energy,ambition to get out of the house,no more aches and pains,and no side affects at all so far!I think this drug works differently for everyone,and lovley for me!!!
",111,Yes,['abidal'],No,[],No,[],"I depression anxiety issue since husband 25 yr diagnose 4th stage throat cancer october.He go thru radical chemo radiation , plus surgery , heal cancer free say , however caretaker , realize I go thru serious depression , cause flat scar death ! I abidal 2 week , notice difference first day ! ! I feel great , finally energy , ambition get house , ache pain , side affect far ! I think drug work differently everyone , lovely ! ! !"
file439.txt.txt,"After losing serval loved ones in a few months time,I became very depressed, and started taking Abidal at 20 mg.  Immediately had terrific head-aches, dry mouth, (very thirsty) constipation. Not 100% functional. At 2 months, started 60mg, and have gained 15 pounds in 3 months, have sweats, anxiety, always exhausted, no concentration what so ever. Very difficult to stay focused.  Also have muscle spasms which I never had before. Do not have constipation now, but have several BM's a day - always normal prior to taking Abidal.  Not sure if I still want to take this medication, and will discuss with Dr.
",102,Yes,['abidal'],Yes,"['constipation', 'dry mouth', 'spasm', 'sweats']",Yes,"['20 mg.', '60mg']","After lose serval love one month time , I become depressed , start take abidal 20 mg . Immediately terrific head-aches , dry mouth , ( thirsty ) constipation . Not 100 % functional . At 2 month , start 60mg , gain 15 pound 3 month , sweat , anxiety , always exhaust , concentration ever . Very difficult stay focus . Also muscle spasm I never . Do constipation , several BM 's day - always normal prior take abidal . Not sure I still want take medication , discus Dr ."
file1608.txt.txt,"This medication has changed my life. I have been able to get back to normal living because of it.  If I forget to take it, I do get a little dizzy.  But, nothing I can't handle.  I am in the process of weaning off it, which means a day on, a day off.  So far so good.
",57,No,[],No,[],No,[],"This medication change life . I able get back normal living . If I forget take , I get little dizzy . But , nothing I ca n't handle . I process wean , mean day , day . So far good ."
file1125.txt.txt,"i read on tv its not good to take with thyroid disorders
",12,No,[],No,[],No,[],read tv good take thyroid disorder
file1800.txt.txt,"I can not stop taking ecstapin. I feel pain in my joints, sick to my stomach and night sweats. I have tried to lower the dose very slow.
",28,Yes,['ecstapin'],Yes,"['joint pain', 'stomach pain', 'sweats']",No,[],"I stop take ecstatic . I feel pain joint , sick stomach night sweat . I try low dose slow ."
file1519.txt.txt,"I'd like to know if anyone else felt a larger desire for intercourse? I know when I take 75mg, it really helped with many things. When I jumped to 150mg, it had a negative effect.
",35,No,[],No,[],Yes,"['75mg', '150mg']","I 'd like know anyone else felt large desire intercourse ? I know I take 75mg , really help many thing . When I jumped 150mg , negative effect ."
file1162.txt.txt,"Treated for major depression for many years...Escalan, Exulactin, combo....Started having depression again..and having major aches and pains...hands, feet, legs, hips...started on 120mg Abidal...hard to get used to but all aches and pains have gone away....downside...sweats and lack of sex drive and difficulty ejaculating.
",43,Yes,"['abidal', 'escalan', 'exulactin']",Yes,['sweats'],Yes,['120mg'],"treat major depression many year ... escalan , Exulactin , combo ... .started depression again..and major ache pain ... hand , foot , leg , hip ... start 120mg abidal ... hard get use ache pain go away ... .downside ... sweat lack sex drive difficulty ejaculate ."
file1931.txt.txt,"i have been on Ecstapin for at least ten years. I would have to say that it has, to a degree ruined my life. It is impossible to get off it. I have tried many times but the withdrawl is horrible. I would advise anyone going on this drug to think long and hard about it.
",56,Yes,['ecstapin'],No,[],No,[],"Ecstapin least ten year . I would say , degree ruin life . It impossible get . I try many time withdrawn horrible . I would advise anyone go drug think long hard ."
file1264.txt.txt,"While taking Abidal my mood became very angry all the time, and I lost all interest in sex, and still have not recover it after 5 months.
",27,Yes,['abidal'],No,[],No,[],"While take abidal mood become angry time , I lose interest sex , still recover 5 month ."
file502.txt.txt,"Two words: Miracle Drug. Thanks to Abidal I have been able to function again as a happy and productive college student. I don't know where I would be without it.
",30,Yes,['abidal'],No,[],No,[],Two word : miracle Drug . thanks abidal I able function happy productive college student . I n't know I would without .
file1036.txt.txt,"I am going on week three of 30mg a day. I wake up in the middle of the night, have lost 15 pounds, Have tics that make my whole body shake for long periods of time.My anxiety used to be through the roof, now it's even worse than I ever thought it could be. Help me.
",56,No,[],No,[],Yes,['30mg'],"I go week three 30mg day . I wake middle night , lose 15 pound , Have tic make whole body shake long period time.My anxiety use roof , 's even bad I ever thought could . Help ."
file317.txt.txt,"just prescribed the medication this week.
",6,No,[],No,[],No,[],prescribed medication week .
file1723.txt.txt,"Ecstapin worked great for my depression and anxiety but I need to come off it (it's too expensive) and the withdrawal is horrible. I have been off it for a week and I am constantly dizzy (even feel dizzy in my dreams) and often nauseous.  I am also really irritable and am trying to avoid my co-workers so I don't bite anyone's head off for no reason. When I'm not irritable I feel weepy and lately anxious and paranoid.  I have already started taking Exulactin and I think it is helping.  It is very frustrating that none of the literature talks about length of withdrawal symptoms.  I know it's different for everyone but surely someone has measured this in a test group and can publish the results from that group.  I haven't even been able to find a comment anywhere from someone saying they managed to get off it and are now finally feeling better.  Very disheartening.  Published tests of new drugs should include discontinuation symptoms and observed length of those symptoms. There is no good reason to exclude that data.
",181,Yes,"['ecstapin', 'exulactin']",Yes,['irritable'],No,[],Ecstapin work great depression anxiety I need come ( 's expensive ) withdrawal horrible . I week I constantly dizzy ( even feel dizzy dream ) often nauseous . I also really irritable try avoid co-worker I n't bite anyone 's head reason . When I 'm irritable I feel weepy lately anxious paranoid . I already start take Exulactin I think help . It frustrate none literature talk length withdrawal symptom . I know 's different everyone surely someone measure test group publish result group . I n't even able find comment anywhere someone say manage get finally feel well . Very dishearten . publish test new drug include discontinuation symptom observe length symptom . There good reason exclude data .
file190.txt.txt,"this medicine in combo with my other med has put me back on top of my game only down side i seem to have insomnia which is opposite of what it should be
",33,No,[],Yes,['insomnia'],No,[],medicine combo med put back top game side seem insomnia opposite
