filename,text,word_count,has_medication,medication_mention,has_side_effect,side_effect_mention,has_dosage,side_dosage,cleansed_text
file4.txt.txt,"this med does perk you up, but after 4 weeks of bein on it. the sleepless night, even though i'm on fortifex, got to me. and the restlessness started to get overwhelming i couldn't concentrate at work.i felt i had adhd. however, the very worst part was coming off. I fell into an abyss of depression, one which i have never experienced before, i had to go back on the prexifan and taper myself off for a month. even then i was having a continous panic attack with heart pounding, no eating for 4-5 days, severe sense of lonliness, guilt, and poor self-worth. It was absolutely miserable that lasted for about 6-10 days. I have family support, but needed to see a psychiatrist (still waiting for visit). Be very cautious going on this med. it's great for a couple weeks, but very exhausting.
",143,Yes,"['fortifex', 'prexifan']",Yes,['heart attack'],No,[],"med perk , 4 week bein . sleepless night , even though 'm fortify , get . restlessness start get overwhelm could n't concentrate work.i felt add . however , bad part come . I fell abyss depression , one never experienced , go back prexifan taper month . even continuous panic attack heart pound , eat 4-5 day , severe sense loneliness , guilt , poor self-worth . It absolutely miserable last 6-10 day . I family support , need see psychiatrist ( still wait visit ) . Be cautious go med . 's great couple week , exhaust ."
file25.txt.txt,"I started this medication with Exulactin and at first felt ok pretty quickly then out of nowhere became agitated with angry outbursts, my medication wa cut in half and I became confused, afraid to drive and very tired all the time, the Exulactin was stopped but I feel the same on the Prexifan. I don't know what to do next, it's scary to feel this way. I'll talk to the doctor but wanted to warn people to be careful while driving and pay attention to your mood, my moods worsened and I want to try another medication or go back on exulactin instead. I also feel itchey, so maybe there is an allergy to this drug. I'm not satisfied.
",119,Yes,"['exulactin', 'prexifan']",No,[],No,[],"I start medication Exulactin first felt ok pretty quickly nowhere become agitate angry outburst , medication wa cut half I become confuse , afraid drive tire time , Exulactin stop I feel Prexifan . I n't know next , 's scary feel way . I 'll talk doctor want warn people careful drive pay attention mood , mood worsen I want try another medication go back exulactin instead . I also feel itchy , maybe allergy drug . I 'm satisfied ."
file1529.txt.txt,"I found taking it with the other pills helped me get through my problems
",14,No,[],No,[],No,[],I found take pill help get problem
file417.txt.txt,"a few days after starting abidal i felt much better, however, when i missed a dose i got the most severe jolts that i can only describe as electrical starts.  because i also have a heart condition, this scared me. i looked it up and found out that anxiety can cause these  starts.  (as if you are startled by a sudden noise) i decided that i didn't want to take anything with withdrawal side effects like that and began to ween myself off them. the jolts continued for weeks but eventually they stopped.  mild muscle relaxers helped with the jolts.
",100,Yes,['abidal'],No,[],No,[],"day start abidal felt much well , however , miss dose get severe jolt describe electrical start . also heart condition , scar . look found anxiety cause start . ( startle sudden noise ) decide n't want take anything withdrawal side effect like begin ween . jolt continued week eventually stop . mild muscle relaxer help jolt ."
file1285.txt.txt,"I was terribly depressed because of my medical problems, and the pain they caused. I'm bi-polar, diabetic neuroapathy, and have renal failure just to name a few. I was hateful, mean, didn't want to live, do anything or go anywhere. Didn't even want to play with my dog! I became a reclouse. Thank God for Abidal!! It changed everything for me and my dog is very happy again. We play. My friends are very pleased and can not beleive a pill changed my outlook on life. I'm back to being happy and fun loving andjoking again.
",96,Yes,['abidal'],Yes,['back pain'],No,[],"I terribly depressed medical problem , pain cause . I 'm bi-polar , diabetic neuropathy , renal failure name . I hateful , mean , n't want live , anything go anywhere . Did n't even want play dog ! I become reclose . Thank God abidal ! ! It change everything dog happy . We play . My friend pleased believe pill change outlook life . I 'm back happy fun love unjoking ."
file1073.txt.txt,"I've been on Abidal now for two years, and it has worked better than anything else I've taken, especially in terms of side effects.  I started off on Cenerol, but it didn't seem to work for long, and the sexual side effects were driving me crazier than the depression.  My psychiatrist added Exulactin on top of the Cenerol, but that made me feel like a maniac after just one day, so I stopped taking it.  Then he switched me to Abidal.I have noticed the weight gain ever since I started taking this medication.  I've ballooned up about 40 pounds since I started taking Abidal.  I had no idea so many others were experiencing this as well.  I'm having trouble losing this weight, too.
",123,Yes,"['abidal', 'cenerol', 'exulactin']",Yes,['weight gain'],No,[],"I 've abidal two year , work well anything else I 've take , especially term side effect . I start general , n't seem work long , sexual side effect drive crazier depression . My psychiatrist add Exulactin top general , make feel like maniac one day , I stop take . Then switch abidal.I notice weight gain ever since I start take medication . I 've balloon 40 pound since I start take abidal . I idea many others experience well . I 'm trouble lose weight , ."
file1046.txt.txt,"I have depression, Bells Palsy, ischemic colitis and Migraines.  Abidal has helped with depression 'some', for sure.I have to take other Meds for Bells' Palsy AND chronic headaches   Migraine.  Abidal takes much of the sex drive away.  Not becauseI am not intimate with my wife and enjoy sex, but because it makes having an orgasm difficult.  Don't know why?
",59,Yes,['abidal'],Yes,"['colitis', 'headache']",No,[],"I depression , Bells palsy , ischemic colitis migraine . abidal help depression 'some ' , sure.I take bed Bells ' palsy AND chronic headache migraine . abidal take much sex drive away . Not intimate wife enjoy sex , make orgasm difficult . Do n't know ?"
file1238.txt.txt,"I didn't realize how many physical side effects there were with depression.  When I was placed on Abidal (after many failed attemps with other treatments) the physical side effects became almost non-existant within the first few weeks.  I have now been on Abidal for over a year.  I think this is one that can really help me.
",57,Yes,['abidal'],No,[],No,[],I n't realize many physical side effect depression . When I place abidal ( many fail attempt treatment ) physical side effect become almost non-existant within first week . I abidal year . I think one really help .
file43.txt.txt,"I've been taking Prexifan for a few months now. I lost 17 pounds, have a spotless apartment, but can't sit down for long, nor sleep for very long.  I then discovered Rescue Remedy a liquid herb that takes the edge off and helps sleep longer than a couple of hours. Drops under your tongue on in your water and you might be able to get a full 8 hrs of sleep, like I now do. I highly recommend this to all.
",81,Yes,['prexifan'],No,[],No,[],"I 've take Prexifan month . I lose 17 pound , spotless apartment , ca n't sit long , sleep long . I discover rescue remedy liquid herb take edge help sleep longer couple hour . drop tongue water might able get full 8 hr sleep , like I . I highly recommend ."
file366.txt.txt,"I have suffered from depression my whole life and have taken almost every anti-depressants made. Some worked for awhile and others not at all. When my doctor suggested abidal when one of the others had stopped working I thought,  here we go again.  I was so surprised with the results, it has worked better than any antidepressant I have ever taken and I feel better than I have in my life. I have been taking abidal for over five years now and it is still doing the job.  I know everyone is different, I have a friend it caused him bad nausea, but I never had any problem.  I am so grateful for finally finding a medication that has worked good for as long as it has. Even if it stopped working tomorrow I would still recommend abidal for the past years that it did work.
",146,Yes,['abidal'],Yes,['nausea'],No,[],"I suffer depression whole life take almost every anti-depressants make . Some work awhile others . When doctor suggest abidal one others stop work I thought , go . I surprised result , work well antidepressant I ever take I feel well I life . I take abidal five year still job . I know everyone different , I friend cause bad nausea , I never problem . I grateful finally find medication work good long . Even stop work tomorrow I would still recommend abidal past year work ."
file1267.txt.txt,"I suffered from depression, anxiety attacks and fibromyalgia.  The constant pain has been alleviated as well as the depression and anxiety.  I would not trade the abidal for anything.  I am finally alive again.I am currently a full time caregiver for mymother and mother-in-law both suffering from alzheimers.  I can't even imagine getting through a day with them the way i felt before the abidal.  It has greatly improved my wellbeing.
",71,Yes,['abidal'],No,[],No,[],"I suffer depression , anxiety attack fibromyalgia . The constant pain alleviate well depression anxiety . I would trade abidal anything . I finally alive again.I currently full time caregiver mother mother-in-law suffer alzheimers . I ca n't even imagine get day way felt abidal . It greatly improve wellbeing ."
file409.txt.txt,"Using this medication has greatly lessened my depression and my anxiety. Things do not seem to bother me nearly as much as it used to. I used to cry myself to sleep every night and wondered why I should even be alive. Since abidal, I am a totally different person.
",50,Yes,['abidal'],No,[],No,[],"use medication greatly lessen depression anxiety . Things seem bother nearly much use . I use cry sleep every night wonder I even alive . Since abidal , I totally different person ."
file1573.txt.txt,"This medication saved my life. I was in a pit after a major depressive episode. I was at the end of my rope and wanted to die. I found a wonderful therapist who worked with my doctor to find a medication to help me. I am now balanced and sometimes even happy. I will never stop taking Ecstapin. Never.
",59,Yes,['ecstapin'],No,[],No,[],This medication save life . I pit major depressive episode . I end rope want die . I found wonderful therapist work doctor find medication help . I balance sometimes even happy . I never stop take Ecstapin . Never .
file149.txt.txt,"I've been on abidal and prexifan 5mg a day for 7 months now and they don't seem to be doing anything for my depression,I have neuropathy and the abidal helps with the nerve pain,along with 100mg of imitap
",38,Yes,"['abidal', 'imitap', 'prexifan']",No,[],Yes,"['5mg', '100mg']","I 've abidal prexifan 5mg day 7 month n't seem anything depression , I neuropathy abidal help nerve pain , along 100mg imitate"
file247.txt.txt,"I have taken Prexifan 5mg. for over a year with Abidal 60 mg and Topomax 200 mg.  This seems to have worked  quite well for me except the Prexifan made me experience restless leg syndrome horribly and gain over 50 lbs. in a year.  I receive treatment witha pain treatment center for back and hip issues and cannot include restless leg problems as well with the excessive weight gain.  I plan to get off the Prexifan because of the ease of weight gain.  Depression has been under control for quite some time now. Wish me luck.  Topomax is suppose to help with weight loss, not with Prexifan.  I've never taken a medication that has caused such weight gain.  Good luck to all and to me.
",125,Yes,"['abidal', 'prexifan']",Yes,"['back pain', 'weight gain', 'weight loss']",Yes,"['5mg.', '60 mg', '200 mg.']","I take Prexifan 5mg . year abidal 60 mg Toomay 200 mg . This seem work quite well except Prexifan make experience restless leg syndrome horribly gain 50 lb . year . I receive treatment pain treatment center back hip issue include restless leg problem well excessive weight gain . I plan get Prexifan ease weight gain . Depression control quite time . wish luck . Toomay suppose help weight loss , Prexifan . I 've never take medication cause weight gain . Good luck ."
file1250.txt.txt,"Abidal has helped me alot.  I took elevex for years but had a 'burn out  Abidal made me happy again
",20,Yes,"['abidal', 'elevex']",No,[],No,[],abidal help clot . I take eleven year 'burn abidal make happy
file362.txt.txt,"Helps somewhat but doesn't help with sleep issues and fibromyalgia issues
",11,No,[],No,[],No,[],help somewhat n't help sleep issue fibromyalgia issue
file120.txt.txt,"This medicine does help me slow my ADD/ADHD brain down a little but it also slows my physical abilities down where it is more difficult the exercise, walk,bike and going up and down the stairs. So I'm not sure yet if I want to stay on this or try something new.
",51,No,[],No,[],No,[],"This medicine help slow ADD/ADD brain little also slows physical ability difficult exercise , walk , bike go stair . So I 'm sure yet I want stay try something new ."
file143.txt.txt,"This drug has helped me greatly with my overall feelings.  I am now energetic, feel happy and have interest in things again.  My only complaint is that it doesn't help with my anger.
",33,No,[],No,[],No,[],"This drug help greatly overall feeling . I energetic , feel happy interest thing . My complaint n't help anger ."
file112.txt.txt,"Upon starting Prexifan, my vision worsened and I constantly blink, and I am uncomfortable with or without my glasses.  I have also noticed slight leg cramping. The extra energy I feel is regurgitated into anxiety.  I know I have things to do, but just sit and fret over them instead of getting them done. I can no longer sleep at night, nor take a nap.  It is not good for someone with GAD along with depression.
",76,Yes,['prexifan'],No,[],No,[],"Upon start Prexifan , vision worsen I constantly blink , I uncomfortable without glass . I also notice slight leg cramp . The extra energy I feel regurgitate anxiety . I know I thing , sit fret instead get do . I longer sleep night , take nap . It good someone AGD along depression ."
file1923.txt.txt,"It took 3 adjustments to doses, but after 3 months, I woke up and just felt better.  I wanted to dress, shower and live.  Anyone who deals with depressions knows what i'm talking about--I'm not so gloomy all the time.  I do have some anxiety issues still...but i contribute that to being around people again after being at home for months straight without leaving the house (except to grocery shop).life outside of the house is scary, and i am learning how to deal with people again.  And there are some pretty stupid people in the world...
",96,No,[],No,[],No,[],"It take 3 adjustment dos , 3 month , I woke felt well . I want dress , shower live . anyone deal depression know 'm talk -- I 'm gloomy time . I anxiety issue still ... contribute around people home month straight without leave house ( except grocery shop ) .life outside house scary , learn deal people . And pretty stupid people world ..."
file321.txt.txt,"My muscles ached and I wanted to die every morning
",10,No,[],No,[],No,[],My muscle ache I want die every morning
file1989.txt.txt,"excellent to take for depression...calm and easy feelings but the worst constripation of my life! so difficult i had to come off it and when i did i had the worst nightmares and was really irritable and quick to anger
",40,No,[],Yes,"['irritable', 'nightmares']",No,[],excellent take depression ... calm easy feeling bad constipation life ! difficult come bad nightmare really irritable quick anger
file1421.txt.txt,"Severe dizziness, anxiety, panic, and suicidal thinking.
",7,No,[],Yes,['dizziness'],No,[],"Severe dizziness , anxiety , panic , suicidal think ."
file1145.txt.txt,"My feet are freezing all the time. I get upset and angry easily. Suicidal thoughts. Become a hermit. No sex drive. Can't achieve orgasm. Weird or bad dreams. Abdominal cramps. Urination hesitation too almost wetting myself. More depressed. Confused, can'tthink straight. Irrational behavior at times. Weight gain. Hungry a lot. Just want too be left alone. No energy at all.
",60,No,[],Yes,['weight gain'],No,[],"My foot freeze time . I get upset angry easily . suicidal thought . become hermit . No sex drive . Ca n't achieve orgasm . weird bad dream . Abdominal cramp . trination hesitation almost wet . More depressed . Confused , can'think straight . irrational behavior time . Weight gain . hungry lot . Just want left alone . No energy ."
file1878.txt.txt,"It has been a life saver. I had a really bad year in 08. My brother died on my birthday, my Mother died in July(three months later) I took care of both of them. I just gave up when they were gone. Ecstapin has been really effective for me.
",49,Yes,['ecstapin'],No,[],No,[],"It life saver . I really bad year 08 . My brother die birthday , Mother die July ( three month later ) I take care . I give go . Ecstapin really effective ."
file1964.txt.txt,"Worked very well to relieve my depression. I noticed a change in mood the day after I started it. I have a few side effects, including a diminished appetite, and for the first week I was wired and shaky and woke up a lot during the night, but those went away after my body adjusted to the drug.  The trade-off was definitely worth it.
",64,No,[],No,[],No,[],"work well relieve depression . I notice change mood day I start . I side effect , include diminish appetite , first week I wire shaky woke lot night , go away body adjust drug . The trade-off definitely worth ."
file1983.txt.txt,"at first I was taking the generic version of this and it was GREAT!!! I was finally happy like having sunshine after rain and darkness (I even lost weight!)... however after about 7-10 days it stoped working. Dr. increased the dosage and again after 7 days it didn't work as well. overall I liked this meds but it sucks that I could not stay in the sunshine :(
",68,No,[],Yes,['weight gain'],No,[],first I take generic version GREAT ! ! ! I finally happy like sunshine rain darkness ( I even lose weight ! ) ... however 7-10 day stop work . Dr. increase dosage 7 day n't work well . overall I like med suck I could stay sunshine : (
file1999.txt.txt,"I have been on Ecstapin for over a year.  Feeling great, no suicidal tendencies or thoughts.
",16,Yes,['ecstapin'],No,[],No,[],"I Ecstapin year . Feeling great , suicidal tendency thought ."
file266.txt.txt,"This med helps me sleep at night, but only partially I always end up waking up.  It also makes me very hungry, which I hate!!@@$ I haven't taken a dump in weeks and I sweat profusely. I do not want to take this med anymore. It is not helping stabelize my mood at all! It just makes me constipated!@$$#
",59,No,[],No,[],No,[],"This med help sleep night , partially I always end wake . It also make hungry , I hate ! ! @ @ $ I n't take dump week I sweat profusely . I want take med anymore . It help stabilize mood ! It make constipate ! @ $ $ #"
file1263.txt.txt,"Does NOTHING FOR PAIN!~!I have been on this for 5 months and at first it seemed to work but it doesn't anymore.
",22,No,[],No,[],No,[],Does NOTHING FOR PAN ! ~ ! I 5 month first seem work n't anymore .
file280.txt.txt,"starting feeling better only after about 7 to 9 days. I laughed with my kids for the first time in i cant remember when. It felt great
",27,No,[],No,[],No,[],start feel well 7 9 day . I laugh kid first time cant remember . It felt great
file1120.txt.txt,"Been on this for near 2 years - started with 40mg inc. to 60 then had gastric bypass and raised to 90 - now I had 3 day crying jag, tried jumping out of moving vehicle - agressive behavior - not a good thing!  dropped back to 60 mg on my own and feeling much back to my old  could care less  self - I have learned to live this way in the past years of my life.....could be worse!!!!
",80,No,[],No,[],Yes,"['40mg', '60 mg']","Been near 2 year - start 40mg inc. 60 gastric bypass raise 90 - I 3 day cry jag , try jumping move vehicle - aggressive behavior - good thing ! drop back 60 mg feel much back old could care less self - I learn live way past year life ... ..could bad ! ! ! !"
file285.txt.txt,"I hate this drug,I spend all my time sleeping and the drug caused tremors similar to Parkinson I have been on it a very short time and I find myself jerking awake at night and even twitching when I am asleep.I would not recommend this drug to anyone.
",48,No,[],Yes,['itching'],No,[],"I hate drug , I spend time sleep drug cause tremor similar Parkinson I short time I find jerking awake night even twitch I asleep.I would recommend drug anyone ."
file1431.txt.txt,"Sucessful treatment
",2,No,[],No,[],No,[],successful treatment
file1209.txt.txt,"I began with 30mg and I was also taking another antidepressant, (at the moment I cannot remember the name).  Initially, within the first 30 days, I had trouble urinating.  Seeing my doctor the second time 30 days out she discontinued my other antidepressant.  The urination problem went away.  After 2 months, I began 60mg taking one a day.  This worked for several months, about a year.  I then began to be depressed.  I have just begun 90mg and am in my 4th day and  am presently having a positive effect, otherwise, I would not be writing this at 6:45AM on a Sunday morning.  I will update.
",106,No,[],No,[],Yes,"['30mg', '60mg', '90mg']","I begin 30mg I also take another antidepressant , ( moment I remember name ) . initially , within first 30 day , I trouble urinate . Seeing doctor second time 30 day discontinue antidepressant . The urination problem go away . After 2 month , I begin 60mg take one day . This work several month , year . I begin depressed . I begin 90mg 4th day presently positive effect , otherwise , I would write 6:45AM Sunday morning . I update ."
file181.txt.txt,"I have been using prexifan along with Cenerol,and it has done me well,a little tird some and some dreams out of the ordinary,but overall  had great results.
",27,Yes,"['cenerol', 'prexifan']",No,[],No,[],"I use prexifan along general , do well , little third dream ordinary , overall great result ."
file1918.txt.txt,"This medication has been a life savor for me. I have been able to function in the real world.  Extended release  tablets make a huge difference in getting me through the day. I use with other combinations of medications and believe that it is important to stick with the program. I have for 8 years.
",55,No,[],No,[],No,[],This medication life savor . I able function real world . extend release tablet make huge difference get day . I use combination medication believe important stick program . I 8 year .
file10.txt.txt,"have been on 10mg prexifan for 6 months along with 2000mg noderall 1mg gemulex and fortifex when needed. have not noticed any change in mood or any side effects. can still sleep 20 hrs. per day or none at all for days. and am as depressed as ever.hope i find my combination soon, has been a long 30 years with this disease.
",62,Yes,"['fortifex', 'gemulex', 'noderall', 'prexifan']",No,[],Yes,"['10mg', '2000mg', '1mg']","10mg prexifan 6 month along 2000mg overall 1mg gemul fortify need . notice change mood side effect . still sleep 20 hr . per day none day . depressed ever.hope find combination soon , long 30 year disease ."
file1799.txt.txt,"Started on this drug 3yrs. ago on 150mg it worked for me, but the worst was when I missed a(just 1) dose; my side affects were horrible; nausea, vomiting, headaches,lightheaded,dizziness,and unable to sleep.  Decided to get off the medication because I could no longer take the side effects when I missed a dose. Even though the doctor brought me down slow the withdrawals were still not good. It has now been 2 1/2 weeks since I have been off, things are better but I am still having the withdrawal symptoms. Even though this medication can help; make sure that the pros out way the cons, other wise try to find something else that gives the same relief.
",117,No,[],Yes,"['dizziness', 'headache', 'nausea', 'vomiting']",Yes,['150mg'],"start drug 3yrs . ago 150mg work , bad I miss ( 1 ) dose ; side affect horrible ; nausea , vomit , headache , lightheaded , dizziness , unable sleep . decide get medication I could longer take side effect I miss dose . Even though doctor brought slow withdrawal still good . It 2 1/2 week since I , thing well I still withdrawal symptom . Even though medication help ; make sure pro way con , wise try find something else give relief ."
file462.txt.txt,"Dosage: 1 30mg pill.  Positives: Clearer thought processes, less sadness and fatigue.  Negatives: Felt loopy  high , talked excessively/rapidly, extremities  felt  cold but actual temperature was normal/warm, skin  felt  likeit was rubbed off - very sensitive, intermittent/uncontrollable muscle spasms, insomnia, sweating.  Refused to take another pill.  Side effects lasted 48 and more hours.
",53,No,[],Yes,"['insomnia', 'spasm', 'sweating']",Yes,['30mg'],"dosage : 1 30mg pill . Positive : clearer thought process , less sadness fatigue . negative : Felt loopy high , talk excessively/rapidly , extremity felt cold actual temperature normal/warm , skin felt like rubbed - sensitive , intermittent/uncontrollable muscle spasm , insomnia , sweat . refuse take another pill . side effect last 48 hour ."
